{
  "bankId": "xi-thought-intro-001",
  "title": "习近平新时代中国特色社会主义思想概论 导论练习题库",
  "description": "示例题库，包含单选、多选和判断题。",
  "version": "1.0.0",
  "locale": "zh-CN",
  "subject": "思政",
  "tags": [
    "练卷练习",
    "导论"
  ],
  "questionTypes": {
    "single_choice": {
      "label": "单项选择题",
      "defaultPoints": 1
    },
    "multiple_choice": {
      "label": "多项选择题",
      "defaultPoints": 2
    },
    "true_false": {
      "label": "判断题",
      "defaultPoints": 1
    }
  },
  "sections": [
    {
      "id": "intro",
      "title": "导论",
      "description": "课程导论与基本概念",
      "questionIds": [
        "q1",
        "q2",
        "q3"
      ]
    }
  ],
  "questions": [
    {
      "id": "q1",
      "number": 1,
      "sectionId": "intro",
      "type": "single_choice",
      "prompt": "全面依法治国的重点任务和主体工程是（）。",
      "points": 1,
      "difficulty": "easy",
      "tags": [
        "法治政府"
      ],
      "source": {
        "importType": "导入题",
        "origin": "PDF参考",
        "chapter": "第九章 法治政府"
      },
      "options": [
        {
          "id": "A",
          "label": "A",
          "text": "法治国家建设"
        },
        {
          "id": "B",
          "label": "B",
          "text": "法治政府建设"
        },
        {
          "id": "C",
          "label": "C",
          "text": "法治社会建设"
        },
        {
          "id": "D",
          "label": "D",
          "text": "依法行政"
        }
      ],
      "answer": {
        "correctOptionIds": [
          "B"
        ]
      },
      "explanation": "法治政府建设是全面依法治国的重点任务和主体工程。"
    },
    {
      "id": "q2",
      "number": 2,
      "sectionId": "intro",
      "type": "multiple_choice",
      "prompt": "关于习近平新时代中国特色社会主义思想的理论来源，下列说法正确的是（）。",
      "points": 2,
      "difficulty": "medium",
      "tags": [
        "理论来源"
      ],
      "source": {
        "importType": "扩展题",
        "origin": "导论",
        "chapter": "理论继承发展"
      },
      "options": [
        {
          "id": "A",
          "label": "A",
          "text": "它继承和发展了马克思列宁主义、毛泽东思想等理论成果"
        },
        {
          "id": "B",
          "label": "B",
          "text": "它立足中国实际并总结新时代实践经验"
        },
        {
          "id": "C",
          "label": "C",
          "text": "它只是一套经济政策"
        },
        {
          "id": "D",
          "label": "D",
          "text": "它吸收了中华优秀传统文化养分"
        }
      ],
      "answer": {
        "correctOptionIds": [
          "A",
          "B",
          "D"
        ]
      },
      "explanation": "理论来源应同时体现马克思主义继承、中国实践经验和中华优秀传统文化。"
    },
    {
      "id": "q3",
      "number": 3,
      "sectionId": "intro",
      "type": "true_false",
      "prompt": "实施就业优先战略，体现的是就业在民生中的基础地位。",
      "points": 1,
      "difficulty": "easy",
      "tags": [
        "就业优先"
      ],
      "source": {
        "importType": "导入题",
        "origin": "扩展题",
        "chapter": "第十一章 就业优先"
      },
      "options": [
        {
          "id": "A",
          "label": "正确",
          "text": "正确"
        },
        {
          "id": "B",
          "label": "错误",
          "text": "错误"
        }
      ],
      "answer": {
        "correctOptionIds": [
          "A"
        ]
      },
      "explanation": "就业是最基本的民生，就业优先战略体现了这一点。"
    }
  ]
}
